{
  "diagnostics": [
    {
      "artifact_kind": "java-persistence-mapping-evidence",
      "diagnostic_id": "optional_evidence_existing_only_not_available",
      "effect": "Optional evidence is not present and will not be produced by the default bounded execution plan.",
      "optional_by": [
        "repository-inventory"
      ],
      "production_policy": "existing_only",
      "schema_version": "java-persistence-mapping-evidence/v1",
      "severity": "info"
    },
    {
      "artifact_kind": "java-type-structure-evidence",
      "diagnostic_id": "optional_evidence_existing_only_not_available",
      "effect": "Optional evidence is not present and will not be produced by the default bounded execution plan.",
      "optional_by": [
        "repository-inventory"
      ],
      "production_policy": "existing_only",
      "schema_version": "java-type-structure-evidence/v1",
      "severity": "info"
    },
    {
      "artifact_kind": "model-storage-evidence",
      "diagnostic_id": "optional_evidence_existing_only_not_available",
      "effect": "Optional evidence is not present and will not be produced by the default bounded execution plan.",
      "optional_by": [
        "repository-inventory"
      ],
      "production_policy": "existing_only",
      "schema_version": "model-storage-evidence/v1",
      "severity": "info"
    },
    {
      "artifact_kind": "persistence-lineage-evidence",
      "diagnostic_id": "optional_evidence_existing_only_not_available",
      "effect": "Optional evidence is not present and will not be produced by the default bounded execution plan.",
      "optional_by": [
        "repository-inventory"
      ],
      "production_policy": "existing_only",
      "schema_version": "persistence-lineage-evidence/v1",
      "severity": "info"
    },
    {
      "artifact_kind": "reference-data-evidence",
      "diagnostic_id": "optional_evidence_existing_only_not_available",
      "effect": "Optional evidence is not present and will not be produced by the default bounded execution plan.",
      "optional_by": [
        "repository-inventory"
      ],
      "production_policy": "existing_only",
      "schema_version": "reference-data-evidence/v1",
      "severity": "info"
    },
    {
      "artifact_kind": "sql-analysis",
      "diagnostic_id": "optional_evidence_existing_only_not_available",
      "effect": "Optional evidence is not present and will not be produced by the default bounded execution plan.",
      "optional_by": [
        "repository-inventory"
      ],
      "production_policy": "existing_only",
      "schema_version": "sql-analysis/v1",
      "severity": "info"
    },
    {
      "artifact_kind": "storage-usage-evidence",
      "diagnostic_id": "optional_evidence_existing_only_not_available",
      "effect": "Optional evidence is not present and will not be produced by the default bounded execution plan.",
      "optional_by": [
        "repository-inventory"
      ],
      "production_policy": "existing_only",
      "schema_version": "storage-usage-evidence/v1",
      "severity": "info"
    },
    {
      "artifact_kind": "system-description-evidence",
      "diagnostic_id": "optional_evidence_existing_only_not_available",
      "effect": "Optional evidence is not present and will not be produced by the default bounded execution plan.",
      "optional_by": [
        "repository-inventory"
      ],
      "production_policy": "existing_only",
      "schema_version": "system-description-evidence/v1",
      "severity": "info"
    },
    {
      "artifact_kind": "value-flow-evidence",
      "diagnostic_id": "optional_evidence_existing_only_not_available",
      "effect": "Optional evidence is not present and will not be produced by the default bounded execution plan.",
      "optional_by": [
        "repository-inventory"
      ],
      "production_policy": "existing_only",
      "schema_version": "value-flow-evidence/v1",
      "severity": "info"
    }
  ],
  "expected_outputs": {
    "capabilities": [
      "common.repository-concept-candidates",
      "common.repository-coverage",
      "common.repository-coverage-gaps",
      "common.repository-data-footprint",
      "common.repository-discovery",
      "common.repository-identity",
      "common.repository-inputs-outputs",
      "common.repository-interfaces",
      "common.repository-inventory",
      "common.repository-novelty",
      "common.repository-storage-footprint",
      "common.repository-structural-families",
      "common.repository-technologies"
    ],
    "knowledge_models": [
      "repository-inventory/v3"
    ]
  },
  "foundation_requirements": [],
  "graph": {
    "edges": [
      {
        "edge_kind": "produces_evidence",
        "from": "analyzer:data-model-candidate-analyzer:datamart_profile_fl",
        "to": "evidence:planned_evidence_17f63bbd05ac595107236b30"
      },
      {
        "edge_kind": "produces_evidence",
        "from": "analyzer:interaction-boundary-analyzer:datamart_profile_fl",
        "to": "evidence:planned_evidence_e8e8b780aed650dae6daebfc"
      },
      {
        "edge_kind": "produces_evidence",
        "from": "analyzer:repository-structure-analyzer:datamart_profile_fl",
        "to": "evidence:planned_evidence_6bbfd2eabcab8c1b961f1a2d"
      },
      {
        "edge_kind": "produces_evidence",
        "from": "analyzer:structured-file-shape-analyzer:datamart_profile_fl",
        "to": "evidence:planned_evidence_27a8360303edca65c1260006"
      },
      {
        "edge_kind": "optional_evidence",
        "from": "evidence:planned_evidence_17f63bbd05ac595107236b30",
        "to": "materialization:repository-inventory"
      },
      {
        "edge_kind": "optional_evidence",
        "from": "evidence:planned_evidence_27a8360303edca65c1260006",
        "to": "materialization:repository-inventory"
      },
      {
        "edge_kind": "required_evidence",
        "from": "evidence:planned_evidence_6bbfd2eabcab8c1b961f1a2d",
        "to": "materialization:repository-inventory"
      },
      {
        "edge_kind": "optional_evidence",
        "from": "evidence:planned_evidence_e8e8b780aed650dae6daebfc",
        "to": "materialization:repository-inventory"
      },
      {
        "edge_kind": "produces_knowledge",
        "from": "materialization:repository-inventory",
        "to": "knowledge:planned_knowledge_7ec8466da979080cae0065d2"
      },
      {
        "edge_kind": "source_input",
        "from": "source:datamart_profile_fl",
        "to": "analyzer:data-model-candidate-analyzer:datamart_profile_fl"
      },
      {
        "edge_kind": "source_input",
        "from": "source:datamart_profile_fl",
        "to": "analyzer:interaction-boundary-analyzer:datamart_profile_fl"
      },
      {
        "edge_kind": "source_input",
        "from": "source:datamart_profile_fl",
        "to": "analyzer:repository-structure-analyzer:datamart_profile_fl"
      },
      {
        "edge_kind": "source_input",
        "from": "source:datamart_profile_fl",
        "to": "analyzer:structured-file-shape-analyzer:datamart_profile_fl"
      }
    ],
    "execution_order": [
      "analyzer:data-model-candidate-analyzer:datamart_profile_fl",
      "analyzer:interaction-boundary-analyzer:datamart_profile_fl",
      "analyzer:repository-structure-analyzer:datamart_profile_fl",
      "analyzer:structured-file-shape-analyzer:datamart_profile_fl",
      "materialization:repository-inventory"
    ],
    "nodes": [
      {
        "analyzer_id": "data-model-candidate-analyzer",
        "evidence_requirements": [
          {
            "artifact_kind": "data-model-candidate-evidence",
            "contract_fingerprint": "50eb699550f99be0088e68ba74d0cbfb191ff0eb9a4398f7fa7758ef2ffdd779",
            "optional_by": [
              "repository-inventory"
            ],
            "production_policy": "produce_if_missing",
            "required_by": [],
            "schema_version": "data-model-candidate-evidence/v1"
          }
        ],
        "execution_required": true,
        "expected_outputs": [
          {
            "artifact_kind": "data-model-candidate-evidence",
            "schema_version": "data-model-candidate-evidence/v1"
          }
        ],
        "foundation_requirements": [],
        "node_id": "analyzer:data-model-candidate-analyzer:datamart_profile_fl",
        "node_kind": "core_evidence_analyzer",
        "runtime_contract_id": "core_evidence_runtime/v1",
        "source_id": "datamart_profile_fl",
        "source_snapshot_id": "source_snapshot_1fbcee64bf96a8ce707a782f"
      },
      {
        "analyzer_id": "interaction-boundary-analyzer",
        "evidence_requirements": [
          {
            "artifact_kind": "interaction-boundary-evidence",
            "contract_fingerprint": "67c6d2667dfaea030d8d1efade29f7120fc3c36c5a32be380b7fc17d149cae6f",
            "optional_by": [
              "repository-inventory"
            ],
            "production_policy": "produce_if_missing",
            "required_by": [],
            "schema_version": "interaction-boundary-evidence/v1"
          }
        ],
        "execution_required": true,
        "expected_outputs": [
          {
            "artifact_kind": "interaction-boundary-evidence",
            "schema_version": "interaction-boundary-evidence/v1"
          }
        ],
        "foundation_requirements": [],
        "node_id": "analyzer:interaction-boundary-analyzer:datamart_profile_fl",
        "node_kind": "core_evidence_analyzer",
        "runtime_contract_id": "core_evidence_runtime/v1",
        "source_id": "datamart_profile_fl",
        "source_snapshot_id": "source_snapshot_1fbcee64bf96a8ce707a782f"
      },
      {
        "analyzer_id": "repository-structure-analyzer",
        "evidence_requirements": [
          {
            "artifact_kind": "repository-structure-evidence",
            "contract_fingerprint": "75b0b1e721c92c97bbc587185ff74df3f041610e4b90b2e61ece37c08efc6f80",